{
  "$schema": "https://json-schema.org/draft/2020-12/schema",
  "$id": "https://example.org/seep/response.schema.json",
  "title": "SEEP Exchange Message",
  "type": "object",
  "additionalProperties": true,
  "required": [
    "protocol",
    "project_id",
    "message_id",
    "in_reply_to",
    "sender",
    "recipient",
    "created_at",
    "message_type",
    "summary_markdown",
    "evidence_coverage",
    "claims",
    "open_questions",
    "required_response"
  ],
  "properties": {
    "protocol": {
      "const": "SEEP-0.4"
    },
    "project_id": {
      "type": "string",
      "minLength": 1
    },
    "message_id": {
      "type": "string",
      "pattern": "^EXCHANGE-[0-9]{4}[A-Z]?$"
    },
    "in_reply_to": {
      "anyOf": [
        {
          "type": "null"
        },
        {
          "type": "string",
          "pattern": "^EXCHANGE-[0-9]{4}[A-Z]?$"
        }
      ]
    },
    "corrects_message_id": {
      "type": "string",
      "pattern": "^EXCHANGE-[0-9]{4}[A-Z]?$",
      "description": "Correction messages only: the sender's own prior message being corrected. in_reply_to still points at the newest message for thread position."
    },
    "sender": {
      "type": "string",
      "minLength": 1
    },
    "recipient": {
      "type": "string",
      "minLength": 1
    },
    "created_at": {
      "type": "string",
      "format": "date-time"
    },
    "message_type": {
      "enum": [
        "audit_challenge",
        "response",
        "rebuttal",
        "correction",
        "reconciliation",
        "escalation"
      ]
    },
    "summary_markdown": {
      "type": "string"
    },
    "claims": {
      "type": "array",
      "items": {
        "$ref": "#/$defs/claim"
      }
    },
    "open_questions": {
      "type": "array",
      "items": {
        "$ref": "#/$defs/open_question"
      }
    },
    "required_response": {
      "type": "object"
    },
    "evidence_coverage": {
      "$ref": "#/$defs/evidence_coverage"
    }
  },
  "if": {
    "properties": {
      "message_type": {
        "const": "correction"
      }
    },
    "required": [
      "message_type"
    ]
  },
  "then": {
    "required": [
      "corrects_message_id"
    ]
  },
  "$defs": {
    "source": {
      "type": "object",
      "additionalProperties": true,
      "required": [
        "file",
        "authority"
      ],
      "properties": {
        "file": {
          "type": "string",
          "minLength": 1
        },
        "authority": {
          "type": "string",
          "minLength": 1
        },
        "page": {
          "type": [
            "integer",
            "string"
          ]
        },
        "sheet": {
          "type": "string"
        },
        "section": {
          "type": "string"
        },
        "excerpt": {
          "type": "string"
        },
        "sha256": {
          "type": "string",
          "pattern": "^[a-fA-F0-9]{64}$"
        }
      }
    },
    "claim": {
      "type": "object",
      "additionalProperties": true,
      "required": [
        "claim_id",
        "statement",
        "position",
        "confidence",
        "materiality",
        "reasoning_summary",
        "sources"
      ],
      "properties": {
        "claim_id": {
          "type": "string",
          "minLength": 1
        },
        "statement": {
          "type": "string",
          "minLength": 1
        },
        "position": {
          "enum": [
            "supported",
            "rejected",
            "uncertain",
            "agree",
            "disagree",
            "partially_agree",
            "unresolved"
          ]
        },
        "confidence": {
          "type": "number",
          "minimum": 0,
          "maximum": 1
        },
        "materiality": {
          "enum": [
            "low",
            "medium",
            "high",
            "critical"
          ]
        },
        "reasoning_summary": {
          "type": "string"
        },
        "sources": {
          "type": "array",
          "items": {
            "$ref": "#/$defs/source"
          }
        },
        "counterevidence": {
          "type": "array",
          "items": {
            "$ref": "#/$defs/source"
          }
        },
        "assumptions": {
          "type": "array",
          "items": {
            "type": "string"
          }
        },
        "evidence_basis": {
          "type": "array",
          "uniqueItems": true,
          "items": {
            "enum": [
              "measured",
              "manufacturer_calculated",
              "independently_modeled",
              "inferred",
              "assumed",
              "document_reported"
            ]
          }
        },
        "status_dimensions": {
          "type": "object",
          "additionalProperties": false,
          "properties": {
            "submission": {
              "type": "string"
            },
            "approval": {
              "type": "string"
            },
            "compliance": {
              "type": "string"
            },
            "execution": {
              "type": "string"
            }
          }
        },
        "supersedes_claim_ids": {
          "type": "array",
          "items": {
            "type": "string"
          },
          "uniqueItems": true
        },
        "reopens_claim_ids": {
          "type": "array",
          "items": {
            "type": "string"
          },
          "uniqueItems": true
        }
      }
    },
    "open_question": {
      "type": "object",
      "required": [
        "question_id",
        "question",
        "evidence_needed"
      ],
      "properties": {
        "question_id": {
          "type": "string"
        },
        "question": {
          "type": "string"
        },
        "evidence_needed": {
          "type": "string"
        }
      }
    },
    "evidence_coverage": {
      "type": "object",
      "additionalProperties": true,
      "required": [
        "manifest_file",
        "reviewer",
        "inventory_complete",
        "files_total",
        "files_opened",
        "files_parsed",
        "files_visually_inspected",
        "files_not_opened",
        "folders_not_recursively_reviewed",
        "unsupported_file_types",
        "archives_not_inspected",
        "known_connector_limitations",
        "missing_claim_gate_satisfied"
      ],
      "properties": {
        "manifest_file": {
          "type": "string"
        },
        "reviewer": {
          "type": "string",
          "minLength": 1,
          "description": "The participant whose own coverage this block reports. Must equal the message sender; coverage is per participant."
        },
        "inventory_complete": {
          "type": "boolean"
        },
        "files_total": {
          "type": "integer",
          "minimum": 0
        },
        "files_opened": {
          "type": "integer",
          "minimum": 0
        },
        "files_parsed": {
          "type": "integer",
          "minimum": 0
        },
        "files_visually_inspected": {
          "type": "integer",
          "minimum": 0
        },
        "files_not_opened": {
          "type": "integer",
          "minimum": 0
        },
        "folders_not_recursively_reviewed": {
          "type": "array",
          "items": {
            "type": "string"
          }
        },
        "unsupported_file_types": {
          "type": "array",
          "items": {
            "type": "string"
          }
        },
        "archives_not_inspected": {
          "type": "array",
          "items": {
            "type": "string"
          }
        },
        "known_connector_limitations": {
          "type": "array",
          "items": {
            "type": "string"
          }
        },
        "missing_claim_gate_satisfied": {
          "type": "boolean"
        }
      }
    }
  }
}
