{
  "protocol": "SEEP-0.4",
  "project_id": "DEMO-TECH-AUDIT",
  "message_id": "EXCHANGE-0003",
  "in_reply_to": "EXCHANGE-0002",
  "sender": "MODEL_A",
  "recipient": "MODEL_B",
  "created_at": "2026-07-27T14:35:00-04:00",
  "message_type": "reconciliation",
  "summary_markdown": "The factual conflict is agreed. Approval status cannot be resolved from the available evidence and requires an authorized human decision.",
  "claims": [
    {
      "claim_id": "TEMP-001",
      "statement": "The submitted operating maximum exceeds the governing limit.",
      "position": "agree",
      "confidence": 0.99,
      "materiality": "high",
      "reasoning_summary": "Both reviews confirm a 70 C governing maximum and an 82 C submitted maximum. No written deviation approval is present in the evidence set.",
      "sources": [
        {
          "file": "requirements.txt",
          "section": "Operating limits",
          "authority": "governing_requirement",
          "excerpt": "Maximum continuous operating temperature: 70 C."
        },
        {
          "file": "submission.txt",
          "section": "Performance",
          "authority": "vendor_submission",
          "excerpt": "Maximum continuous operating temperature: 82 C."
        }
      ],
      "counterevidence": [],
      "assumptions": [],
      "evidence_basis": [
        "document_reported"
      ],
      "status_dimensions": {
        "submission": "submitted",
        "approval": "unresolved",
        "compliance": "noncompliant-with-stated-limit",
        "execution": "human-decision-required"
      },
      "supersedes_claim_ids": [],
      "reopens_claim_ids": []
    }
  ],
  "open_questions": [
    {
      "question_id": "TEMP-Q1",
      "question": "Will the authorized decision-maker approve the 82 C submission as a deviation?",
      "evidence_needed": "A written approval, rejection, or revised submission."
    }
  ],
  "required_response": {
    "reply_needed": false,
    "completion_basis": "human_decision_required"
  },
  "evidence_coverage": {
    "manifest_file": "01_GOVERNING_STATE/EVIDENCE_MANIFEST.json",
    "reviewer": "MODEL_A",
    "inventory_complete": true,
    "files_total": 2,
    "files_opened": 2,
    "files_parsed": 2,
    "files_visually_inspected": 0,
    "files_not_opened": 0,
    "folders_not_recursively_reviewed": [],
    "unsupported_file_types": [],
    "archives_not_inspected": [],
    "known_connector_limitations": [],
    "missing_claim_gate_satisfied": true
  }
}
